### ISSUE TITLE
SNMP reply from different IP address than sent to

### ISSUE THREAD

**Issue by mzsombor** [hh-h/aiosnmp#27]
Does aiosnmp compare the source ip of the received snmp packet to the destination address of the sent snmp packet?

I'm dealing with an unusual network scenario where the polled device might reply with a different IP Address, see example below:

```
08:46:54.952262 IP 172.21.32.33.46818 > 192.168.2.1.161:  C="TEST" GetRequest(28)  system.sysDescr.0
08:46:54.984631 IP 10.168.1.1.171 > 172.21.32.33.46818:  C="TEST" GetResponse(68)  system.sysDescr.0="Software Version ..."
```

I can see the snmp reply in tcpdump but aiosnmp does not seem to detect it, I get the default Timeout behavior. I don't know if this is a justified use case but other linux snmp tools support it. I looked in the source code but I was unable to change the behavior of the received datagram.

I would like to know if this is even possible and if yes some hints on what to modify would be helpful.

Thank you.

**Comment by hh-h** [comment]
Yes, the library expects that reply should be received from the same address (host and port), see https://github.com/hh-h/aiosnmp/blob/master/aiosnmp/protocols.py#L107
I did a quick research and figured out that it should not compare host/port.
I don't want to remove this feature, but I think I can add a flag to disable it, something like `Snmp(..., disable_src_addr_validation=True)`

**Comment by mzsombor** [comment]
thanks for the quick reply. If you think it will be useful for others as well disable_src_addr_validation would be great. If not, a piece of code with the modification would be really appreciated :D

**Comment by mzsombor** [comment]
FYI I tried to use `key = (port, message.data.request_id)` instead of `key = (host, port, message.data.request_id)`

https://github.com/hh-h/aiosnmp/blob/master/aiosnmp/protocols.py#L107
https://github.com/hh-h/aiosnmp/blob/master/aiosnmp/protocols.py#L129

And for the normal use case `source ip reply == destination ip get` it is still OK, but still NOT OK for `source ip reply != destination ip get` -> timeout.

It seems to me that the `datagram_received` is never triggered. From what I've read this is an underlying function of the asyncio.DatagramProtocol so I'm not sure this problem can be purely solved from aiosnmp.

https://docs.python.org/3/library/asyncio-protocol.html#asyncio.DatagramProtocol

**Comment by hh-h** [comment]
It is against RFC, so it should be supported. I'll try to implement it on the weekend, but if you need it asap, just replace
```
key = (host, port, message.data.request_id)
```
with 
```
key = message.data.request_id
```
here https://github.com/hh-h/aiosnmp/blob/master/aiosnmp/protocols.py#L107 and here https://github.com/hh-h/aiosnmp/blob/master/aiosnmp/protocols.py#L129
should do the trick.

**Comment by hh-h** [comment]
Hello! Please, check the 0.4.0 version, here is an example: https://github.com/hh-h/aiosnmp/blob/v0.4.0/tests/test_snmp.py#L242

**Comment by mzsombor** [comment]
Hello.

First of all thanks for the updates.

I tried version 0.4.0 but the reply is still not detected even though the request key only contains the `request_id`. After doing some debugging I observed that the datagram_received from the `SnmpProtocol` is never triggered. From what I've read this is an underlying method of the asyncio.DatagramProtocol so I'm not sure this problem can be purely solved from aiosnmp.

https://docs.python.org/3/library/asyncio-protocol.html#asyncio.DatagramProtocol

**Comment by hh-h** [comment]
But snmpget from the console works fine?
Could you check other python libraries? `pysnmp` and `netsnmp`? Or provide a reproducible example, via docker-compose, for example, I'll take a look.

**Comment by mzsombor** [comment]
Linux snmpget, https://linux.die.net/man/1/snmpget, is OK:

```
snmpget -v 2c --clientaddr=172.21.1.1 -c test 192.168.1.1 .1.3.6.1.2.1.1.1.0
SNMPv2-MIB::sysDescr.0 = STRING: Software Version 1
```

tcpdump output:
```
sudo tcpdump -i any port 161
tcpdump: data link type LINUX_SLL2
tcpdump: verbose output suppressed, use -v[v]... for full protocol decode
listening on any, link-type LINUX_SLL2 (Linux cooked v2), snapshot length 262144 bytes
08:42:21.018972 eth4  Out IP 172.21.1.1.55603 > 192.168.1.1.161:  C="test" GetRequest(28)  system.sysDescr.0
08:42:21.092992 eth4  In  IP 169.254.1.1.161 > 172.21.1.1.55603:  C="test" GetResponse(68)  system.sysDescr.0="Software Version 1"
```

I used pysnmp in the past and it was working but I don't have a lab for it right now. I will try to come up with a reproducible example and share it with you. I will also try it without setting the source ip address.

**Comment by mzsombor** [comment]
@hh-h I'm not sure if this is what you were expecting but let me know how can I improve it. I don't know how to use docker compose but I was able to create a somewhat reproducible example with `docker playground` and `linux iptable`:

aiosnmp on alpine container <-- SNMP --> iptables redirect on alpine container <-- SNMP--> koshh/aiosnmp container 


**DOCKER PLAYGROUND SETUP** - https://labs.play-with-docker.com/

docker run -it -d koshh/aiosnmp
docker run -it -d alpine
docker run -it -d alpine
docker ps
```
CONTAINER ID   IMAGE           COMMAND           CREATED          STATUS          PORTS              NAMES
109d9a244c60   alpine          "/bin/sh"         18 minutes ago   Up 18 minutes                      cranky_napier
b786ac2164e5   alpine          "/bin/sh"         30 minutes ago   Up 30 minutes                      quizzical_benz
f3b9be89ab71   koshh/aiosnmp   "/bootstrap.sh"   32 minutes ago   Up 32 minutes   161/tcp, 161/udp   vigorous_carver
```

docker inspect f3b9be89ab71 | grep IPAddress
```
            "SecondaryIPAddresses": null,
            "IPAddress": "172.17.0.2",
                    "IPAddress": "172.17.0.2",
```

docker inspect 109d9a244c60 | grep IPAdd
```
            "SecondaryIPAddresses": null,
            "IPAddress": "172.17.0.4",
                    "IPAddress": "172.17.0.4",
```

**REDIRECT SNMP FROM .4 to .2**
docker exec -it --privileged 109d9a244c60 sh
iptables -t nat -A PREROUTING -p udp --dport 161 -j DNAT --to-destination 172.17.0.2:161
iptables -t nat -L
```
Chain PREROUTING (policy ACCEPT)
target     prot opt source               destination         
DNAT       udp  --  anywhere             anywhere             udp dpt:snmp to:172.17.0.2:161
...
```

**SNMP REDIRECT OK for .4**
docker exec -it b786ac2164e5 sh
apk add net-snmp-tools
snmpget -v 2c -c public 172.17.0.4 .1.3.6.1.2.1.1.1.0
```
SNMPv2-MIB::sysDescr.0 = STRING: Linux f3b9be89ab71 4.4.0-96-generic #119-Ubuntu SMP Tue Sep 12 14:59:54 UTC 2017 x86_64
```

**Check source IP with TCPDUMP, reply comes from .2 not .4**
docker exec -it b786ac2164e5 sh
apk add tcpdump
tcpdump -i any port 161
```
listening on any, link-type LINUX_SLL2 (Linux cooked v2), snapshot length 262144 bytes
09:46:57.944571 eth0  Out IP b786ac2164e5.53915 > 172.17.0.4.161:  GetRequest(28)  system.sysDescr.0
09:46:57.945074 eth0  In  IP 172.17.0.2.161 > b786ac2164e5.53915:  GetResponse(115)  system.sysDescr.0="Linux f3b9be89ab71 4.4.0-96-generic #119-Ubuntu SMP Tue Sep 12 14:59:54 UTC 2017 x86_64"
```

**Aiosnmp test**
apk add python3
apk add py3-pip
pip3 install aiosnmp

**OK**
vi test1.py
```
import asyncio
import aiosnmp

async def main():
    async with aiosnmp.Snmp(host="172.17.0.2", port=161, community="public", validate_source_addr=False) as snmp:
        for res in await snmp.get(".1.3.6.1.2.1.1.1.0"):
            print(res.oid, res.value)

asyncio.run(main())
```
python3 test1.py
```
.1.3.6.1.2.1.1.1.0 b'Linux f3b9be89ab71 4.4.0-96-generic #119-Ubuntu SMP Tue Sep 12 14:59:54 UTC 2017 x86_64'
```

**NOT OK**
vi test2.py
```
import asyncio
import aiosnmp

async def main():
    async with aiosnmp.Snmp(host="172.17.0.4", port=161, community="public", validate_source_addr=False) as snmp:
        for res in await snmp.get(".1.3.6.1.2.1.1.1.0"):
            print(res.oid, res.value)

asyncio.run(main())
```
python3 test2.py
```
Traceback (most recent call last):
  File "test2.py", line 9, in <module>
    asyncio.run(main())
  File "/usr/lib/python3.8/asyncio/runners.py", line 44, in run
    return loop.run_until_complete(main)
  File "/usr/lib/python3.8/asyncio/base_events.py", line 616, in run_until_complete
    return future.result()
  File "test2.py", line 6, in main
    for res in await snmp.get(".1.3.6.1.2.1.1.1.0"):
  File "/usr/lib/python3.8/site-packages/aiosnmp/snmp.py", line 73, in get
    return await self._send(message)
  File "/usr/lib/python3.8/site-packages/aiosnmp/snmp.py", line 67, in _send
    return await self._protocol._send(message, *self._peername[:2])
  File "/usr/lib/python3.8/site-packages/aiosnmp/protocols.py", line 147, in _send
    raise SnmpTimeoutError
aiosnmp.exceptions.SnmpTimeoutError
```

**output of tcpdump**

```
### TEST1

10:01:01.348826 IP 172.17.0.3.59099 > 172.17.0.2.161:  GetRequest(28)  system.sysDescr.0
10:01:01.348905 IP 172.17.0.3.59099 > 172.17.0.2.161:  GetRequest(28)  system.sysDescr.0
10:01:01.349178 IP 172.17.0.2.161 > 172.17.0.3.59099:  GetResponse(115)  system.sysDescr.0="Linux f3b9be89ab71 4.4.0-96-generic #119-Ubuntu SMP Tue Sep 12 14:59:54 UTC 2017 x86_64"
10:01:01.349399 IP 172.17.0.2.161 > 172.17.0.3.59099:  GetResponse(115)  system.sysDescr.0="Linux f3b9be89ab71 4.4.0-96-generic #119-Ubuntu SMP Tue Sep 12 14:59:54 UTC 2017 x86_64"

###TEST2 - reply comes from .2 aiosnmp ignores it, even though snmpget was working

10:01:06.876204 IP 172.17.0.3.49116 > 172.17.0.4.161:  GetRequest(28)  system.sysDescr.0
10:01:06.876247 IP 172.17.0.3.49116 > 172.17.0.4.161:  GetRequest(28)  system.sysDescr.0
10:01:06.876284 IP 172.17.0.3.49116 > 172.17.0.2.161:  GetRequest(28)  system.sysDescr.0
10:01:06.876294 IP 172.17.0.3.49116 > 172.17.0.2.161:  GetRequest(28)  system.sysDescr.0
10:01:06.876454 IP 172.17.0.2.161 > 172.17.0.3.49116:  GetResponse(115)  system.sysDescr.0="Linux f3b9be89ab71 4.4.0-96-generic #119-Ubuntu SMP Tue Sep 12 14:59:54 UTC 2017 x86_64"
10:01:06.876475 IP 172.17.0.2.161 > 172.17.0.3.49116:  GetResponse(115)  system.sysDescr.0="Linux f3b9be89ab71 4.4.0-96-generic #119-Ubuntu SMP Tue Sep 12 14:59:54 UTC 2017 x86_64"

```

**Comment by hh-h** [comment]
Wow, that's a very good manual, I'll take a look on the weekend.

**Comment by hh-h** [comment]
Please, check the new 0.5.0 version, on my test stand it works now (even with local_addr), but you still need `validate_source_addr=False`

**Comment by mzsombor** [comment]
> Please, check the new 0.5.0 version, on my test stand it works now (even with local_addr), but you still need `validate_source_addr=False`

It works!!! Big thumbs up. I really appreciate the help.

I'm quite curious what was the issue with the previous release. I reviewed the changes in the new version but I don't quite understand which part made it work. Was it this change https://github.com/hh-h/aiosnmp/pull/29/files#diff-2563c30f62c6f0197428fbaeb4d1d99323b07613b7950ca6f02fc949d7b88806R141 that solved the problem?

**Comment by hh-h** [comment]
full commit related to fix the issue https://github.com/hh-h/aiosnmp/pull/29/commits/9a08cfd0f30d6b1a8ed7281cf02c37a1be03bc34
